{
  "resume_parsed": {
    "name": "AKSHAT SUNIL JAIN",
    "email": "jainakshatsunil@gmail.com",
    "phone": "+91 9723981419",
    "summary": "AKSHAT SUNIL JAIN PERSONAL DETAILS Address: CAREER OBJECTIVE H-104 Samanvay Park, Haria",
    "skills": [
      "technology",
      "combining expertise in medicinal chemistry",
      "data visualization"
    ],
    "raw_head": "AKSHAT SUNIL JAIN\nPERSONAL DETAILS\nAddress: CAREER OBJECTIVE\nH-104 Samanvay Park, Haria\n\u201cEmerging leader at the intersection of pharmaceutical research and\nPark, Silvassa Road, Vapi,\ntechnology, combining expertise in medicinal chemistry, data visualization,\nGujarat, India - 396195\nGenerative AI etc. Committed to driving innovation in pharma R&D by\nContact: +91 9723981419\nharnessing AI, Generative technologies, Prompt Engineering and Clinical\nE-mail ID:\ncompliance tools to build efficient, ethical, and insight-driven healthcare\njainakshatsunil@gmail.com\nsolutions\u201d\n.\nACADEMIC BACKGROUND\nLINKEDIN\nDEGREE BOARD INSTITUTE PASSING % /\nYEAR C.G.P.A.\nM.S.(Pharm.)\nin Medicinal - NIPER, S.A.S. 2026 9.75\nChemistry NAGAR\nGujarat Smt. B.N.B.\nBachelor of Technological Swaminaryan 2020 - 2024\nPharmacy University Pharmacy College, 9.24\nSalvav, Vapi.\nAkshat Sunil Jain\nH.S.C. CBSE Shri L.G. Haria 2020 94.8\nMultipurpose\nSchool, Vapi\nS.S.C. CBSE Shri L.G. Haria 2018 87.4\nMultipurpose\nSchool, Vapi\nKEY STRENGTHS RESEARCH PROJECT\n\uf0b7 Proactive The objective of the project is \u201cDesign, S ynthesis and Biological Evaluation of\nPyridopyrimidine based Novel Phospha-Flavone Analogs as Potential\n\uf0b7 Social engagement\nAntibacterial Agents\u201d . (2025-2026)\n\uf0b7 Multi tasking\n\uf0b7 Team Player SKILLS\n\uf0b7 Leadership\n\uf0b7 Planning & Execution \uf0b7 Clinical Knowledge: ICH-GCP (Certified) & SOP Drafting.\n\uf0b7 Flexi bility and \uf0b7 Data & BI Tools: Python, SQL, R, Excel, Tableau, JMP, Power BI,\nAdap tability DOE.\n\uf0b7 Strong work ethics \uf0b7 AI & Programming: Prompt Engineering(Advanced), ChatGPT and\n\uf0b7 Risk Management Gemini Powered Data Analysis, Fine-Tuning LLMs, SAS (Basic),\nMachine Learning, Neural Networks, EDA, RAG Modelling, Google\nLANGUAGE\nColab, AI Workflows and Automations, MCP Server, Chatbot"
  },
  "jd_parsed": {
    "raw": "We are inviting motivated and analytical individuals to join us as ResearchAnalyst Fellows. The fellowship offers hands-on experience in research, reportwriting, and data analysis across development projects, CSR initiatives, NGOoperations, and public-private sector collaborations. Fellows will workclosely with senior researchers and project managers to support ongoingprojects and gain exposure to applied research in social development and publichealth sectors.Key Responsibilities\u2022 Conduct desk research and literature reviews on development, CSR,NGO, and public sector topics.\u2022 Collect, clean, and analyze quantitative and qualitative data using MSExcel, Word, and other tools.\u2022 Prepare structured reports, presentations, and project documentation forinternal and external stakeholders.\u2022 Assist in monitoring and evaluation of projects, including trackingprogress and reporting insights.",
    "required_skills": [
      "and public",
      "and project",
      "we are",
      "inviting motivated",
      "and analytical",
      "individuals to",
      "join us",
      "as researchanalyst",
      "fellows",
      "the fellowship",
      "offers hands",
      "on experience"
    ],
    "preferred_skills": [
      "in research",
      "reportwriting",
      "and data",
      "analysis across",
      "development projects",
      "csr initiatives",
      "ngooperations",
      "private sector"
    ],
    "responsibilities": [
      " Fellows will workclosely with senior researchers and project managers to support ongoingprojects and gain exposure to applied research in social development and publichealth sectors."
    ]
  },
  "ats": {
    "score": 12.0,
    "dimension_scores": {
      "Semantic Match": 0.0,
      "Keyword Coverage": 0.0,
      "Structure": 60.0
    }
  },
  "optimized_resume": "Key Skills: and public, and project, we are, inviting motivated, and analytical, individuals to, join us, as researchanalyst\n\n- AKSHAT SUNIL JAIN\n- PERSONAL DETAILS\n- Address: CAREER OBJECTIVE\n- H-104 Samanvay Park, Haria\n- \u201cEmerging leader at the intersection of pharmaceutical research and\n- Park, Silvassa Road, Vapi,\n- technology, combining expertise in medicinal chemistry, data visualization,\n- Gujarat, India - 396195\n- Generative AI etc. Committed to driving innovation in pharma R&D by\n- Contact: +91 9723981419\n- harnessing AI, Generative technologies, Prompt Engineering and Clinical\n- E-mail ID:\n- compliance tools to build efficient, ethical, and insight-driven healthcare\n- jainakshatsunil@gmail.com\n- solutions\u201d\n.\n- ACADEMIC BACKGROUND\n- LINKEDIN\n- DEGREE BOARD INSTITUTE PASSING % /\nYEAR C.G.P.A.\n- M.S.(Pharm.)\n- in Medicinal - NIPER, S.A.S. 2026 9.75\n- Chemistry NAGAR\nGujarat Smt. B.N.B.\n- Bachelor of Technological Swaminaryan 2020 - 2024\n- Pharmacy University Pharmacy College, 9.24\nSalvav, Vapi.\n- Akshat Sunil Jain\n- H.S.C. CBSE Shri L.G. Haria 2020 94.8\n- Multipurpose\n- School, Vapi\n- S.S.C. CBSE Shri L.G. Haria 2018 87.4\n- Multipurpose\n- School, Vapi\n- KEY STRENGTHS RESEARCH PROJECT\n- \uf0b7 Proactive The objective of the project is \u201cDesign, S ynthesis and Biological Evaluation of\n- Pyridopyrimidine based Novel Phospha-Flavone Analogs as Potential\n- \uf0b7 Social engagement\n- Antibacterial Agents\u201d . (2025-2026)\n- \uf0b7 Multi tasking\n- \uf0b7 Team Player SKILLS\n- \uf0b7 Leadership\n\uf0b7 Planning & Execution \uf0b7 Clinical Knowledge: ICH-GCP (Certified) & SOP Drafting.\n- \uf0b7 Flexi bility and \uf0b7 Data & BI Tools: Python, SQL, R, Excel, Tableau, JMP, Power BI,\nAdap tability DOE.\n- \uf0b7 Strong work ethics \uf0b7 AI & Programming: Prompt Engineering(Advanced), ChatGPT and\n- \uf0b7 Risk Management Gemini Powered Data Analysis, Fine-Tuning LLMs, SAS (Basic),\n- Machine Learning, Neural Networks, EDA, RAG Modelling, Google\n- LANGUAGE\n- Colab, AI Workflows and Automations, MCP Server, Chatbot\n- PROFICIENCY\nDevelopment.\n- \uf0b7 English\n- \uf0b7 Medicinal Chemistry: Synthesis method optimization, UV, IR, NMR &\n- \uf0b7 Hindi\n- MS Data Interpretation, Molecular Docking, Molecular Dynamic\n- \uf0b7 Gujarati\nSimulations, ChemDraw, Chem3D, Mestrenova, ADMET analysis.\n- AREAS OF INTEREST COURSES/ CERTIFICATIONS\n- \uf0b7 ICH GCP \u2013 Nida Training Center\n- \uf0b7 Drug Discovery\n\uf0b7 Google Data Analytics (R, SQL, Excel, Tableau, Power BI) \u2013 Coursera.\n- \uf0b7 Data Analytics\n- \uf0b7 Power BI Bootcamp \u2013 Jobaaj Learnings\n- \uf0b7 Data Science\n- \uf0b7 Prompt Engineering & ChatGPT and Gemini ADA \u2013 IBM, Vanderbilt\n- \uf0b7 Machine Learning\nUniversity, MTF University.\n- \uf0b7 Generative AI\n\uf0b7 SAS Programming (Beginner) \u2013 Udemy.\n- \uf0b7 Market Research\n- \uf0b7 JMP (DOE & Data Analysis) \u2013 NIPER, S.A.S. NAGAR\n- \uf0b7 Competitive Intelligence\n\uf0b7 SQL , Python and Excel Bootcamps \u2013 Letsupgrade.\n- \uf0b7 Chemoinformatics\n- \uf0b7 Generative AI Projects (RAG Models, Machine Learning and MCP\n- \uf0b7 Risk Assessment and\nservers) \u2013 Letsupgrade and AcceleratorX.\n- Mitigation\n- \uf0b7 Business Analytics and Advance Excel \u2013 SkillUP and Udemy\n- \uf0b7 Quality Control and Quality\n- \uf0b7 Strategic Consulting, Digital Intelligence and Data Analytics Job\n- Assurance\n- Simultions\u2013 Forage (offered by BCG, Pwc, Accenture etc.)\n- HOBBIES\n- EXTRA-CURRICULAR ACTIVITIES\n- \uf0b7 Teaching\n- \uf0b7 Finalist in KnockRY and Mindkraft at 81MG\n- \uf0b7 Public Speaking\n- \uf0b7 Semifinalist in Analytica and Shark Tank Niper at 81MG\n- \uf0b7 Networking \uf0fc Conducted Secondary Market Research, streamlined Data\n- \uf0b7 Mindfulness Practice management, and Created Interactive Visualizations to\n\uf0b7 Volleyball derive actionable insights at a glance.\n- \uf0b7 Cooking \uf0b7 Hosted & Organized Republic Day Celebration, Spandan Cultural Fest\nat NIPER, S.A.S. Nagar.\n- PROFESSIONAL \uf0b7 Hosted & Organized many events in UG college\n- AFFILIATIONS \uf0b7 Team Lead - Organized a flea market stall with a 40% margin\n- WORK EXPERIENCE/ INTERNSHIPS\n- \uf0b7 PG Research Scholar,\nNIPER S.A.S Nagar.\n- \uf0b7 Co-Founder & Educator, VIBRAINO \u2013 The Frequency of Knowledge\n- \uf0b7 Placement Coordinator,\n- (2021\u20132024)\n- Department of Medicinal\n- \uf0fc Led 9-Member Team; Designed JEE and NEET course\nChemistry (NIPER, S.A.S.\n- curriculum and mentored 200+ students\n- Nagar)\n- \uf0b7 Senior Faculty (Organic Chemistry), Pharmaminds (2023\u2013Present)\n- \uf0b7 Reviewer, BP International\n- \uf0fc Delivered 20+ hrs coaching for GPAT/NIPER\n- \uf0b7 & JOCAMR (Academic\n- Publications) \uf0b7 Business Dev. Intern, Internshala (2023)\n- \uf0b7 Senior Faculty Member, \uf0fc Boosted campus engagement by 20%; Onboarded 70+ students;\nPharmaminds. Awarded \u201cExceptional Performer\u201d.\n- \uf0b7 Class Representative in \uf0b7 Industrial Intern, Inject Care Parenterals, Vapi (Jul 2023)\nBachelor\u2019s of Pharmacy \uf0fc Supported Sterile Manufacturing and cGMP Documentation.\n- \uf0b7 President of Women\n- Development Cell and KEY ACHIEVEMENTS\n- Research wing in UG college"
}